<?xml version="1.0" encoding="UTF-8"?>
<!DOCTYPE employees [
  <!ELEMENT employees (employee+)>
  <!ELEMENT employee (id, name, department, designation, email, salary)>
  <!ELEMENT id (#PCDATA)>
  <!ELEMENT name (#PCDATA)>
  <!ELEMENT department (#PCDATA)>
  <!ELEMENT designation (#PCDATA)>
  <!ELEMENT email (#PCDATA)>
  <!ELEMENT salary (#PCDATA)>
]>
<employees>
  <employee>
    <id>101</id>
    <name>John Doe</name>
    <department>IT</department>
    <designation>Developer</designation>
    <email>john.doe@example.com</email>
    <salary>50000</salary>
  </employee>

  <employee>
    <id>102</id>
    <name>Jane Smith</name>
    <department>HR</department>
    <designation>Manager</designation>
    <email>jane.smith@example.com</email>
    <salary>60000</salary>
  </employee>

  <employee>
    <id>103</id>
    <name>David Johnson</name>
    <department>Finance</department>
    <designation>Accountant</designation>
    <email>david.johnson@example.com</email>
    <salary>55000</salary>
  </employee>
</employees>
